{
  "rank": 4,
  "headline": "Timeline, quotes, and stats",
  "date_confirmed": "April 4, 2026",
  "sections": [
    {
      "id": "chronology",
      "type": "timeline",
      "title": "What happened",
      "items": [
        { "date": "01-04-2026", "text": "Kickoff and scope lock." },
        { "date": "3 Apr 2026", "text": "First integration build green in CI." },
        { "text": "Timeline items can omit date when the order alone is enough." }
      ]
    },
    {
      "id": "voices",
      "type": "quotes",
      "title": "Stakeholder voices",
      "items": [
        {
          "quote": "We will ship when quality bars are met, not before.",
          "speaker": "Alex Chen",
          "role": "Engineering lead"
        },
        {
          "quote": "Clarity in the brief saves weeks downstream.",
          "speaker": "Jordan Smith"
        }
      ]
    },
    {
      "id": "metrics",
      "type": "stats",
      "title": "By the numbers",
      "columns": 2,
      "items": [
        {
          "label": "Uptime (30d)",
          "value": "99.97%",
          "contexts": ["rolling window", "all regions"],
          "color": "success"
        },
        {
          "label": "Latency p95 (ms)",
          "value": 42.7,
          "context": "API gateway",
          "color": "secondary"
        },
        {
          "label": "Open incidents",
          "value": 0,
          "highlight": true
        }
      ]
    }
  ]
}
