{
  "rank": 1,
  "headline": "Daily Brief — April 5, 2026",
  "summary": "When this file is present for the selected calendar day, the feed shows only this story.",
  "sections": [
    {
      "id": "today",
      "type": "bullet_list",
      "title": "Today",
      "items": [
        { "text": "This file uses the daily naming convention daily_brief_DD-MM-YYYY.json." },
        { "text": "Pick today in the header date control to scope the feed to this brief." }
      ]
    }
  ]
}
