{
  "rank": 9,
  "headline": "Evidence-heavy brief: stats, links, quotes, generic proof",
  "date_confirmed": "04/05/2026",
  "sources_confirmed": [
    "https://example.com/incidents/2026-04",
    "https://example.com/compliance/soc2-summary",
    "https://example.com/blog/postmortem-culture"
  ],
  "summary": "Combines stat value types (string, number, boolean), multiple contexts per card, colors, sourced links, quotes, and generic blocks with embedded stats.",
  "meta": {
    "topic": "Reliability & compliance",
    "audience": "Security + SRE",
    "priority": "P0",
    "tags": ["incidents", "compliance", "postmortem", "evidence"]
  },
  "sections": [
    {
      "id": "incident-stats",
      "type": "stats",
      "title": "Incident and compliance indicators",
      "columns": 2,
      "items": [
        {
          "label": "Customer-visible incidents (30d)",
          "value": 2,
          "contexts": ["both SEV-3", "No data loss"],
          "color": "warning"
        },
        {
          "label": "MTTR (hours)",
          "value": 1.4,
          "context": "mean across incidents",
          "color": "secondary"
        },
        {
          "label": "Control tests passed",
          "value": "47/47",
          "contexts": ["SOC 2 Type II period", "All controls green"],
          "color": "success"
        },
        {
          "label": "Open audit findings",
          "value": 0,
          "highlight": true
        }
      ]
    },
    {
      "id": "references",
      "type": "links",
      "title": "Evidence and policies",
      "items": [
        {
          "label": "Incident log (internal)",
          "url": "https://example.com/incidents/2026-04",
          "source": "Status"
        },
        {
          "label": "SOC 2 executive summary",
          "url": "https://example.com/compliance/soc2-summary",
          "source": "GRC"
        },
        {
          "label": "Postmortem template",
          "url": "https://example.com/templates/postmortem"
        }
      ]
    },
    {
      "id": "leadership-quotes",
      "type": "quotes",
      "title": "Accountability",
      "items": [
        {
          "quote": "Every Sev-2+ gets a blameless postmortem within five business days.",
          "speaker": "VP Engineering",
          "role": "Accountable exec"
        },
        {
          "quote": "We publish customer impact in the same brief as internal root cause.",
          "speaker": "Head of Support",
          "role": "CX"
        }
      ]
    },
    {
      "id": "narrative-proof",
      "type": "generic",
      "title": "Narrative with embedded figures",
      "description": "Generic blocks interleave explanation with numbers and links.",
      "items": [
        {
          "kind": "text",
          "text": "Below, bullets summarize actions; stats restate numbers for scanners and accessibility."
        },
        { "kind": "bullet", "text": "Pager noise reduced after deduplicating alerts on the payment service." },
        {
          "kind": "stat",
          "label": "Alert volume (weekly)",
          "value": 940,
          "contexts": ["Down 18% WoW", "Payment service only"],
          "color": "primary"
        },
        {
          "kind": "stat",
          "label": "Noise ratio",
          "value": "12%",
          "color": "success"
        },
        {
          "kind": "link",
          "label": "Alerting standards",
          "url": "https://example.com/standards/alerting"
        },
        {
          "kind": "quote",
          "quote": "If it pages twice for the same root cause, fix the signal, not the on-call.",
          "speaker": "SRE lead"
        }
      ]
    }
  ]
}
