{
  "headline": "One section of each type",
  "date_confirmed": "05-04-2026",
  "summary": "Kitchen-sink layout: every section type with flexible dates, optional rank, stats colors/contexts, and generic blocks.",
  "sections": [
    {
      "id": "bullets",
      "type": "bullet_list",
      "title": "Bullet list",
      "items": [{ "text": "Structured list with optional per-item notes." }]
    },
    {
      "id": "cards",
      "type": "cards",
      "title": "Cards",
      "items": [
        {
          "title": "Card A",
          "description": "Minimum card is title + description. Add contexts, color, or a CTA as needed.",
          "contexts": ["Optional context line 1", "Optional context line 2"],
          "color": "secondary",
          "cta_label": "Details",
          "cta_url": "https://example.com/a"
        }
      ]
    },
    {
      "id": "links",
      "type": "links",
      "title": "Links",
      "items": [
        { "label": "External", "url": "https://example.org/" }
      ]
    },
    {
      "id": "timeline",
      "type": "timeline",
      "title": "Timeline",
      "items": [
        { "date": "01 Jan 2026", "text": "Start — dates accept any format." },
        { "date": "2026-03-15", "text": "ISO style still works." },
        { "text": "Or omit date when order alone is enough." }
      ]
    },
    {
      "id": "quotes",
      "type": "quotes",
      "title": "Quotes",
      "items": [{ "quote": "One quote is enough to show the section." }]
    },
    {
      "id": "stats",
      "type": "stats",
      "title": "Stats",
      "columns": 2,
      "items": [
        {
          "label": "Example",
          "value": "1",
          "contexts": ["Multiple context lines", "Per stat card"],
          "color": "primary"
        },
        {
          "label": "On track",
          "value": true,
          "context": "Boolean values render as Yes/No",
          "color": "success"
        }
      ]
    },
    {
      "id": "generic",
      "type": "generic",
      "title": "Generic",
      "items": [
        { "kind": "text", "text": "Closing note as a text block." },
        {
          "kind": "stat",
          "label": "Inline stat",
          "value": 42,
          "contexts": ["Inside generic sections too"],
          "color": "warning"
        }
      ]
    }
  ]
}
