{
  "rank": 8,
  "headline": "Long-form narrative with many subsections",
  "date_confirmed": "5 April 2026",
  "sources_confirmed": [
    "https://example.com/quarterly/2026-q1",
    "https://example.com/teams/platform/metrics"
  ],
  "summary": "Multiple sections, rich cards, a full timeline, and stats — typical of an executive or quarterly brief.",
  "meta": {
    "topic": "Quarterly review",
    "audience": "Leadership",
    "priority": "P2",
    "tags": ["quarterly", "platform", "metrics"]
  },
  "sections": [
    {
      "id": "executive-summary",
      "type": "bullet_list",
      "title": "Executive summary",
      "items": [
        { "text": "Revenue and reliability targets were met or exceeded.", "note": "See stats section for figures." },
        { "text": "Two customer incidents exceeded SLA; both resolved within policy." },
        { "text": "Hiring remains on plan; attrition within band." }
      ]
    },
    {
      "id": "deep-dives",
      "type": "cards",
      "title": "Deep dives",
      "items": [
        {
          "category": "Product",
          "title": "Launch readiness",
          "description": "Feature flags, rollback plan, and comms drafted.",
          "cta_label": "Runbook",
          "cta_url": "https://example.com/runbooks/launch"
        },
        {
          "category": "Infra",
          "title": "Capacity",
          "description": "Peak tested at 2× expected Q2 load.",
          "cta_label": "Load test report",
          "cta_url": "https://example.com/reports/load-2026-04"
        },
        {
          "category": "People",
          "title": "Team health",
          "description": "Survey NPS stable; focus on on-call load in EU zone."
        }
      ]
    },
    {
      "id": "milestones",
      "type": "timeline",
      "title": "Quarter milestones",
      "items": [
        { "date": "15 Jan 2026", "text": "Roadmap committed for H1." },
        { "date": "20-02-2026", "text": "Security audit completed with no criticals." },
        { "date": "2026-03-30", "text": "End-of-quarter freeze and retrospective." },
        { "text": "Next quarter planning begins after this brief is published." }
      ]
    },
    {
      "id": "kpis",
      "type": "stats",
      "title": "KPI snapshot",
      "columns": 2,
      "items": [
        {
          "label": "ARR growth YoY",
          "value": "22%",
          "contexts": ["as of quarter close", "Global"],
          "color": "success"
        },
        { "label": "NPS", "value": 48, "context": "customer survey", "color": "primary" },
        { "label": "P95 API latency (ms)", "value": 38.2, "color": "secondary" },
        {
          "label": "Critical open bugs",
          "value": 3,
          "context": "production",
          "color": "error",
          "highlight": true
        }
      ]
    },
    {
      "id": "appendix-generic",
      "type": "generic",
      "title": "Appendix — mixed blocks",
      "items": [
        { "kind": "text", "text": "Use generic sections when a single titled block needs paragraphs, inline stats, and quotes without splitting into many typed sections." },
        { "kind": "bullet", "text": "Keep ids lowercase with hyphens (pattern: ^[a-z0-9-]+$)." },
        {
          "kind": "quote",
          "quote": "Measure twice, ship once.",
          "speaker": "Release manager"
        }
      ]
    }
  ]
}
